title,play,收藏率,author_name
除了学习什么都学的舅舅！！1~38超长合集！,8618374,0.07658161504710749,猫meme电影院
护士姐姐：学吧，这就是商务枪法.丨《内脏医生》02,59892,0.06813931743805517,小熊flippy
《五十六个民族，五十六只噶》终极典藏版,210960,0.0590064467197573,皮蛋瘦肉粥煎鸡蛋
4种红薯的满分吃法！有手就会…但能让你大为震撼！,2376137,0.0524077525832896,元气八眉菌
兜 帽 难 藏 泪 4,317928,0.04845122166025012,sss技巧吐槽
左手《Luvsic》，右手《夜，萤火虫和你》，是什么感觉？,16030621,0.04658590581113483,桓桓Aileen
终极硬筋流狂铁12.0，何为对抗路的尽头,1015802,0.036705972226870984,江东蟹宝王
只用赏心悦目的忍者上段！#4,311507,0.033366826427656524,赵小天咯
尸潮来袭！开局一辆车如何在无穷的高架桥上存活下去！！「高架惊变100天2」,1722076,0.03315184695681259,夏天y
都盲，盲点好啊,352771,0.03262172911038606,高斯Goh
